{
  "instanceId": "tiny-infeasible-capacity",
  "maxDaysPerMedic": 1,
  "periods": [
    { "id": "p1", "dayIds": ["d1"] },
    { "id": "p2", "dayIds": ["d2"] },
    { "id": "p3", "dayIds": ["d3"] }
  ],
  "days": [
    { "id": "d1", "date": "2026-04-17" },
    { "id": "d2", "date": "2026-04-18" },
    { "id": "d3", "date": "2026-04-20" }
  ],
  "medics": [
    { "id": "m1", "name": "Ana" },
    { "id": "m2", "name": "Luis" }
  ],
  "availability": [
    { "medicId": "m1", "dayId": "d1" },
    { "medicId": "m1", "dayId": "d2" },
    { "medicId": "m1", "dayId": "d3" },
    { "medicId": "m2", "dayId": "d1" },
    { "medicId": "m2", "dayId": "d2" },
    { "medicId": "m2", "dayId": "d3" }
  ]
}

